{
  "schema_version": "0.2.0",
  "source_id": "GSM-HELP-PAYMENT-MISMATCH-308",
  "title": "FAQ 3.8 — Trả tiền mặt cho chuyến không tiền mặt",
  "canonical_url": "https://www.greensm.com/vn-vi/helps",
  "requested_url": "https://www.greensm.com/vn-vi/helps",
  "final_url": "https://www.greensm.com/vn-vi/helps",
  "content_selector": "faq:3.8",
  "language": "vi",
  "publisher": "Green SM",
  "fetched_at": "2026-08-10T07:00:31+07:00",
  "http_status": 200,
  "content_type": "text/html; charset=utf-8",
  "raw_sha256": "898e02cb0f3967f8b0d3206fbfa645ee1afec79b88c8b3b9fde65a245f9bf1f8",
  "content_sha256": "f5206e29d67d7223908b81280df9a57235654d3fd3ecaa9f1e5392b0d720d560",
  "extraction_strategy": "dom_semantic",
  "source_last_modified": null,
  "parser_version": "0.2.0",
  "normalizer_version": "0.1.0",
  "materializer_version": "0.2.0",
  "materialization_mode": "next_content_faq",
  "materialization_payload_sha256": "e73f8d52a13c76ce2729272fc85f9bb1f8ed43717cbb011aec200fa4cf37555b",
  "content_kind": "text",
  "ocr_status": null,
  "text_retrieval_eligible": true,
  "asset_urls": [],
  "normalized_text": "3.8. Tôi đã trả tiền mặt cho chuyến xe thanh toán bằng phương thức không dùng tiền mặt\nTài xế chỉ thu tiền mặt cho những chuyến xe bạn chọn phương thức thanh toán là tiền mặt. Trường hợp bạn thấy trên ứng dụng hiển thị phương thức thanh toán không phải tiền mặt nhưng tài xế vẫn yêu cầu thu với lý do không hợp lý, bạn vui lòng yêu cầu tài xế kiểm tra lại ứng dụng hoặc gửi yêu cầu tại mục \"Trung tâm hỗ trợ\" trên ứng dụng Green SM để được kiểm tra và giải đáp kịp thời.\nGreen SM rất tiếc về trải nghiệm thanh toán chưa được trọn vẹn này.",
  "char_count": 538,
  "topic_tags": [
    "payment_mismatch"
  ],
  "priority": "critical",
  "retrieval_role": "standalone",
  "parent_source_id": null,
  "faq_range": [
    "3.8"
  ]
}
