{
  "schema_version": "0.2.0",
  "source_id": "GSM-HELP-FARE-HIGHER-309",
  "title": "FAQ 3.9 — Thanh toán cao hơn số tiền báo ban đầu",
  "canonical_url": "https://www.greensm.com/vn-vi/helps",
  "requested_url": "https://www.greensm.com/vn-vi/helps",
  "final_url": "https://www.greensm.com/vn-vi/helps",
  "content_selector": "faq:3.9",
  "language": "vi",
  "publisher": "Green SM",
  "fetched_at": "2026-08-10T07:00:31+07:00",
  "http_status": 200,
  "content_type": "text/html; charset=utf-8",
  "raw_sha256": "898e02cb0f3967f8b0d3206fbfa645ee1afec79b88c8b3b9fde65a245f9bf1f8",
  "content_sha256": "491927c632382daf4c6e336053d168c951c0525c5eed495e9c393e7b9cbb651c",
  "extraction_strategy": "dom_semantic",
  "source_last_modified": null,
  "parser_version": "0.2.0",
  "normalizer_version": "0.1.0",
  "materializer_version": "0.2.0",
  "materialization_mode": "next_content_faq",
  "materialization_payload_sha256": "e73f8d52a13c76ce2729272fc85f9bb1f8ed43717cbb011aec200fa4cf37555b",
  "content_kind": "text",
  "ocr_status": null,
  "text_retrieval_eligible": true,
  "asset_urls": [],
  "normalized_text": "3.9. Tôi thanh toán nhiều hơn số tiền được báo ban đầu\nCác phụ phí như phí cầu đường, bến bãi, sân bay, v.v. chưa được hiển thị trực tiếp trong cước phí khi đặt xe. Vì vậy, bạn có thể thấy cước phí cuối cùng cao hơn ban đầu. Để kiểm tra chi tiết cước phí, xin vui lòng xem trong phần lịch sử chuyến xe ở mục ‘Hoạt động’. Nếu bạn cảm thấy cước phí không chính xác, hãy gửi yêu cầu tại mục \"Trung tâm hỗ trợ\" trên ứng dụng Green SM để được kiểm tra và giải đáp kịp thời.",
  "char_count": 468,
  "topic_tags": [
    "fare_difference"
  ],
  "priority": "critical",
  "retrieval_role": "standalone",
  "parent_source_id": null,
  "faq_range": [
    "3.9"
  ]
}
