{
  "schema_version": "0.2.0",
  "source_id": "GSM-TERMS-OPERATING",
  "title": "Quy chế hoạt động",
  "canonical_url": "https://www.greensm.com/vn-vi/terms-policies/regulations",
  "requested_url": "https://www.greensm.com/vn-vi/terms-policies/regulations",
  "final_url": "https://www.greensm.com/vn-vi/terms-policies/regulations",
  "content_selector": "page",
  "language": "vi",
  "publisher": "Green SM",
  "fetched_at": "2026-08-10T07:00:32+07:00",
  "http_status": 200,
  "content_type": "text/html; charset=utf-8",
  "raw_sha256": "2d2247f4011082b676975e9e39b74b88dfc8ae1c3d27c96dd7a1771769fda55d",
  "content_sha256": "4cf45cc1418d52d37759b68a8b7b267e3a5dc789c849331b6951aeb7bcafd85a",
  "extraction_strategy": "dom_semantic",
  "source_last_modified": null,
  "parser_version": "0.2.0",
  "normalizer_version": "0.1.0",
  "materializer_version": "0.2.0",
  "materialization_mode": "next_regulations_images",
  "materialization_payload_sha256": "b53db0bd624b74cedcf3d872716a79fb2a8f7e0e5bc81e63af85c4be9fd977a5",
  "content_kind": "image_only",
  "ocr_status": "not_run",
  "text_retrieval_eligible": false,
  "asset_urls": [
    "https://www.greensm.com/images/regulations/quychehoatdong-1.jpg",
    "https://www.greensm.com/images/regulations/quychehoatdong-2.jpg",
    "https://www.greensm.com/images/regulations/quychehoatdong-3.jpg",
    "https://www.greensm.com/images/regulations/quychehoatdong-4.jpg",
    "https://www.greensm.com/images/regulations/quychehoatdong-5.jpg",
    "https://www.greensm.com/images/regulations/quychehoatdong-6.jpg",
    "https://www.greensm.com/images/regulations/quychehoatdong-7.jpg",
    "https://www.greensm.com/images/regulations/quychehoatdong-8.jpg",
    "https://www.greensm.com/images/regulations/quychehoatdong-9.jpg",
    "https://www.greensm.com/images/regulations/quychehoatdong-10.jpg",
    "https://www.greensm.com/images/regulations/quychehoatdong-11.jpg",
    "https://www.greensm.com/images/regulations/quychehoatdong-12.jpg",
    "https://www.greensm.com/images/regulations/quychehoatdong-13.jpg",
    "https://www.greensm.com/images/regulations/quychehoatdong-14.jpg",
    "https://www.greensm.com/images/regulations/quychehoatdong-15.jpg",
    "https://www.greensm.com/images/regulations/quychehoatdong-16.jpg",
    "https://www.greensm.com/images/regulations/quychehoatdong-17.jpg",
    "https://www.greensm.com/images/regulations/quychehoatdong-18.jpg",
    "https://www.greensm.com/images/regulations/quychehoatdong-19.jpg",
    "https://www.greensm.com/images/regulations/quychehoatdong-20.jpg",
    "https://www.greensm.com/images/regulations/quychehoatdong-21.jpg",
    "https://www.greensm.com/images/regulations/quychehoatdong-22.jpg",
    "https://www.greensm.com/images/regulations/quychehoatdong-23.jpg",
    "https://www.greensm.com/images/regulations/quychehoatdong-24.jpg",
    "https://www.greensm.com/images/regulations/quychehoatdong-25.jpg",
    "https://www.greensm.com/images/regulations/quychehoatdong-26.jpg",
    "https://www.greensm.com/images/regulations/quychehoatdong-27.jpg",
    "https://www.greensm.com/images/regulations/quychehoatdong-28.jpg",
    "https://www.greensm.com/images/regulations/quychehoatdong-29.jpg",
    "https://www.greensm.com/images/regulations/quychehoatdong-30.jpg",
    "https://www.greensm.com/images/regulations/quychehoatdong-31.jpg",
    "https://www.greensm.com/images/regulations/quychehoatdong-32.jpg",
    "https://www.greensm.com/images/regulations/quychehoatdong-33.jpg",
    "https://www.greensm.com/images/regulations/quychehoatdong-34.jpg",
    "https://www.greensm.com/images/regulations/quychehoatdong-35.jpg",
    "https://www.greensm.com/images/regulations/quychehoatdong-36.jpg",
    "https://www.greensm.com/images/regulations/quychehoatdong-37.jpg",
    "https://www.greensm.com/images/regulations/quychehoatdong-38.jpg",
    "https://www.greensm.com/images/regulations/quychehoatdong-39.jpg",
    "https://www.greensm.com/images/regulations/quychehoatdong-40.jpg",
    "https://www.greensm.com/images/regulations/quychehoatdong-41.jpg",
    "https://www.greensm.com/images/regulations/quychehoatdong-42.jpg",
    "https://www.greensm.com/images/regulations/quychehoatdong-43.jpg",
    "https://www.greensm.com/images/regulations/quychehoatdong-44.jpg",
    "https://www.greensm.com/images/regulations/quychehoatdong-45.jpg",
    "https://www.greensm.com/images/regulations/quychehoatdong-46.jpg",
    "https://www.greensm.com/images/regulations/quychehoatdong-47.jpg",
    "https://www.greensm.com/images/regulations/quychehoatdong-48.jpg",
    "https://www.greensm.com/images/regulations/quychehoatdong-49.jpg",
    "https://www.greensm.com/images/regulations/quychehoatdong-50.jpg",
    "https://www.greensm.com/images/regulations/quychehoatdong-51.jpg",
    "https://www.greensm.com/images/regulations/quychehoatdong-52.jpg",
    "https://www.greensm.com/images/regulations/quychehoatdong-53.jpg",
    "https://www.greensm.com/images/regulations/quychehoatdong-54.jpg",
    "https://www.greensm.com/images/regulations/quychehoatdong-55.jpg",
    "https://www.greensm.com/images/regulations/quychehoatdong-56.jpg"
  ],
  "normalized_text": "IMAGE_ONLY_DOCUMENT\ntitle: Quy chế hoạt động\nocr_status: not_run\ntext_retrieval_eligible: false\nasset_count: 56\nassets:\n- https://www.greensm.com/images/regulations/quychehoatdong-1.jpg\n- https://www.greensm.com/images/regulations/quychehoatdong-2.jpg\n- https://www.greensm.com/images/regulations/quychehoatdong-3.jpg\n- https://www.greensm.com/images/regulations/quychehoatdong-4.jpg\n- https://www.greensm.com/images/regulations/quychehoatdong-5.jpg\n- https://www.greensm.com/images/regulations/quychehoatdong-6.jpg\n- https://www.greensm.com/images/regulations/quychehoatdong-7.jpg\n- https://www.greensm.com/images/regulations/quychehoatdong-8.jpg\n- https://www.greensm.com/images/regulations/quychehoatdong-9.jpg\n- https://www.greensm.com/images/regulations/quychehoatdong-10.jpg\n- https://www.greensm.com/images/regulations/quychehoatdong-11.jpg\n- https://www.greensm.com/images/regulations/quychehoatdong-12.jpg\n- https://www.greensm.com/images/regulations/quychehoatdong-13.jpg\n- https://www.greensm.com/images/regulations/quychehoatdong-14.jpg\n- https://www.greensm.com/images/regulations/quychehoatdong-15.jpg\n- https://www.greensm.com/images/regulations/quychehoatdong-16.jpg\n- https://www.greensm.com/images/regulations/quychehoatdong-17.jpg\n- https://www.greensm.com/images/regulations/quychehoatdong-18.jpg\n- https://www.greensm.com/images/regulations/quychehoatdong-19.jpg\n- https://www.greensm.com/images/regulations/quychehoatdong-20.jpg\n- https://www.greensm.com/images/regulations/quychehoatdong-21.jpg\n- https://www.greensm.com/images/regulations/quychehoatdong-22.jpg\n- https://www.greensm.com/images/regulations/quychehoatdong-23.jpg\n- https://www.greensm.com/images/regulations/quychehoatdong-24.jpg\n- https://www.greensm.com/images/regulations/quychehoatdong-25.jpg\n- https://www.greensm.com/images/regulations/quychehoatdong-26.jpg\n- https://www.greensm.com/images/regulations/quychehoatdong-27.jpg\n- https://www.greensm.com/images/regulations/quychehoatdong-28.jpg\n- https://www.greensm.com/images/regulations/quychehoatdong-29.jpg\n- https://www.greensm.com/images/regulations/quychehoatdong-30.jpg\n- https://www.greensm.com/images/regulations/quychehoatdong-31.jpg\n- https://www.greensm.com/images/regulations/quychehoatdong-32.jpg\n- https://www.greensm.com/images/regulations/quychehoatdong-33.jpg\n- https://www.greensm.com/images/regulations/quychehoatdong-34.jpg\n- https://www.greensm.com/images/regulations/quychehoatdong-35.jpg\n- https://www.greensm.com/images/regulations/quychehoatdong-36.jpg\n- https://www.greensm.com/images/regulations/quychehoatdong-37.jpg\n- https://www.greensm.com/images/regulations/quychehoatdong-38.jpg\n- https://www.greensm.com/images/regulations/quychehoatdong-39.jpg\n- https://www.greensm.com/images/regulations/quychehoatdong-40.jpg\n- https://www.greensm.com/images/regulations/quychehoatdong-41.jpg\n- https://www.greensm.com/images/regulations/quychehoatdong-42.jpg\n- https://www.greensm.com/images/regulations/quychehoatdong-43.jpg\n- https://www.greensm.com/images/regulations/quychehoatdong-44.jpg\n- https://www.greensm.com/images/regulations/quychehoatdong-45.jpg\n- https://www.greensm.com/images/regulations/quychehoatdong-46.jpg\n- https://www.greensm.com/images/regulations/quychehoatdong-47.jpg\n- https://www.greensm.com/images/regulations/quychehoatdong-48.jpg\n- https://www.greensm.com/images/regulations/quychehoatdong-49.jpg\n- https://www.greensm.com/images/regulations/quychehoatdong-50.jpg\n- https://www.greensm.com/images/regulations/quychehoatdong-51.jpg\n- https://www.greensm.com/images/regulations/quychehoatdong-52.jpg\n- https://www.greensm.com/images/regulations/quychehoatdong-53.jpg\n- https://www.greensm.com/images/regulations/quychehoatdong-54.jpg\n- https://www.greensm.com/images/regulations/quychehoatdong-55.jpg\n- https://www.greensm.com/images/regulations/quychehoatdong-56.jpg",
  "char_count": 3862,
  "topic_tags": [
    "regulation"
  ],
  "priority": "medium",
  "retrieval_role": "standalone",
  "parent_source_id": null,
  "faq_range": null
}
