{
  "schema_version": "0.2.0",
  "source_id": "GSM-HELP-GHOST-TRIP-217",
  "title": "FAQ 2.17 — Hoàn thành chuyến nhưng xe không xuất hiện",
  "canonical_url": "https://www.greensm.com/vn-vi/helps",
  "requested_url": "https://www.greensm.com/vn-vi/helps",
  "final_url": "https://www.greensm.com/vn-vi/helps",
  "content_selector": "faq:2.17",
  "language": "vi",
  "publisher": "Green SM",
  "fetched_at": "2026-08-10T07:00:31+07:00",
  "http_status": 200,
  "content_type": "text/html; charset=utf-8",
  "raw_sha256": "898e02cb0f3967f8b0d3206fbfa645ee1afec79b88c8b3b9fde65a245f9bf1f8",
  "content_sha256": "51df9f931add95a72163b38b467ff40bd4dc5e136d5e1dc0202bbdf9a0e0184e",
  "extraction_strategy": "dom_semantic",
  "source_last_modified": null,
  "parser_version": "0.2.0",
  "normalizer_version": "0.1.0",
  "materializer_version": "0.2.0",
  "materialization_mode": "next_content_faq",
  "materialization_payload_sha256": "e73f8d52a13c76ce2729272fc85f9bb1f8ed43717cbb011aec200fa4cf37555b",
  "content_kind": "text",
  "ocr_status": null,
  "text_retrieval_eligible": true,
  "asset_urls": [],
  "normalized_text": "2.17. Tài xế hoàn thành chuyến xe nhưng thực tế không xuất hiện\nGreen SM rất tiếc về trải nghiệm chưa trọn vẹn trên chuyến xe này. Thông báo cho Green SM tại mục \"Trung tâm hỗ trợ\" trên ứng dụng về các trường hợp sau để được hỗ trợ kịp thời:\n1/ Nếu tài xế không đến đón với lý do không hợp lý, dẫn đến việc bạn phải hủy chuyến xe.\n2/ Nếu bạn không sử dụng chuyến xe nhưng tài xế vẫn hoàn thành chuyến và bạn bị trừ tiền từ thẻ ngân hàng hoặc hình thức thanh toán khác (không phải tiền mặt).",
  "char_count": 490,
  "topic_tags": [
    "trip_no_show",
    "complaint"
  ],
  "priority": "high",
  "retrieval_role": "retrievable_child",
  "parent_source_id": "GSM-HELP-TRIP-002",
  "faq_range": [
    "2.17"
  ]
}
