{
  "schema_version": "0.2.0",
  "source_id": "GSM-HELP-FARE-302",
  "title": "FAQ 3.2 — Cước khi thay đổi điểm đón/đến",
  "canonical_url": "https://www.greensm.com/vn-vi/helps",
  "requested_url": "https://www.greensm.com/vn-vi/helps",
  "final_url": "https://www.greensm.com/vn-vi/helps",
  "content_selector": "faq:3.2",
  "language": "vi",
  "publisher": "Green SM",
  "fetched_at": "2026-08-10T07:00:31+07:00",
  "http_status": 200,
  "content_type": "text/html; charset=utf-8",
  "raw_sha256": "898e02cb0f3967f8b0d3206fbfa645ee1afec79b88c8b3b9fde65a245f9bf1f8",
  "content_sha256": "e33c84e0ac023b48265fe0ad819fecd1e7fa2d1908f2f7d64ae8b091f211628f",
  "extraction_strategy": "dom_semantic",
  "source_last_modified": null,
  "parser_version": "0.2.0",
  "normalizer_version": "0.1.0",
  "materializer_version": "0.2.0",
  "materialization_mode": "next_content_faq",
  "materialization_payload_sha256": "e73f8d52a13c76ce2729272fc85f9bb1f8ed43717cbb011aec200fa4cf37555b",
  "content_kind": "text",
  "ocr_status": null,
  "text_retrieval_eligible": true,
  "asset_urls": [],
  "normalized_text": "3.2. Cước phí sẽ tính như thế nào nếu tôi muốn thay đổi địa chỉ điểm đón/điểm đến\nKhi thay đổi điểm đến, cước phí sẽ được tính lại dựa trên quãng đường đã di chuyển, khoảng cách đến điểm mới cùng với phụ phí thay đổi điểm đến (nếu có).",
  "char_count": 235,
  "topic_tags": [
    "fare"
  ],
  "priority": "medium",
  "retrieval_role": "standalone",
  "parent_source_id": null,
  "faq_range": [
    "3.2"
  ]
}
