{
  "schema_version": "0.2.0",
  "source_id": "GSM-HELP-LOYALTY-405",
  "title": "FAQ 4.5 — Không nhận được điểm Xanh",
  "canonical_url": "https://www.greensm.com/vn-vi/helps",
  "requested_url": "https://www.greensm.com/vn-vi/helps",
  "final_url": "https://www.greensm.com/vn-vi/helps",
  "content_selector": "faq:4.5",
  "language": "vi",
  "publisher": "Green SM",
  "fetched_at": "2026-08-10T07:00:31+07:00",
  "http_status": 200,
  "content_type": "text/html; charset=utf-8",
  "raw_sha256": "898e02cb0f3967f8b0d3206fbfa645ee1afec79b88c8b3b9fde65a245f9bf1f8",
  "content_sha256": "1076a8f485ed0c93e1df4289d79e2e312a19926e166bd27236e43c1fd885fe40",
  "extraction_strategy": "dom_semantic",
  "source_last_modified": null,
  "parser_version": "0.2.0",
  "normalizer_version": "0.1.0",
  "materializer_version": "0.2.0",
  "materialization_mode": "next_content_faq",
  "materialization_payload_sha256": "e73f8d52a13c76ce2729272fc85f9bb1f8ed43717cbb011aec200fa4cf37555b",
  "content_kind": "text",
  "ocr_status": null,
  "text_retrieval_eligible": true,
  "asset_urls": [],
  "normalized_text": "4.5. Tôi không nhận được điểm Xanh cho chuyến xe\nNếu chuyến xe của bạn không nhận Điểm Xanh, hãy liên hệ Green SM để được kiểm tra và giải đáp ngay.\nKiểm tra Điểm Xanh tại mục Tài khoản -> Hạng thành viên -> Lịch sử điểm của tôi.",
  "char_count": 229,
  "topic_tags": [
    "loyalty"
  ],
  "priority": "high",
  "retrieval_role": "standalone",
  "parent_source_id": null,
  "faq_range": [
    "4.5"
  ]
}
