{
  "schema_version": "0.2.0",
  "source_id": "GSM-HELP-INVOICE-304",
  "title": "FAQ 3.4 — Xuất và kiểm tra hóa đơn VAT",
  "canonical_url": "https://www.greensm.com/vn-vi/helps",
  "requested_url": "https://www.greensm.com/vn-vi/helps",
  "final_url": "https://www.greensm.com/vn-vi/helps",
  "content_selector": "faq:3.4",
  "language": "vi",
  "publisher": "Green SM",
  "fetched_at": "2026-08-10T07:00:31+07:00",
  "http_status": 200,
  "content_type": "text/html; charset=utf-8",
  "raw_sha256": "898e02cb0f3967f8b0d3206fbfa645ee1afec79b88c8b3b9fde65a245f9bf1f8",
  "content_sha256": "775aa3ed0e218fdb8ee07040e4dbd1405ab14c43f998d5e5d1ad046a87f32a04",
  "extraction_strategy": "dom_semantic",
  "source_last_modified": null,
  "parser_version": "0.2.0",
  "normalizer_version": "0.1.0",
  "materializer_version": "0.2.0",
  "materialization_mode": "next_content_faq",
  "materialization_payload_sha256": "e73f8d52a13c76ce2729272fc85f9bb1f8ed43717cbb011aec200fa4cf37555b",
  "content_kind": "text",
  "ocr_status": null,
  "text_retrieval_eligible": true,
  "asset_urls": [],
  "normalized_text": "3.4. Hướng dẫn yêu cầu xuất hóa đơn VAT và cách kiểm tra hóa đơn với các chuyến xe Green SM\nĐể yêu cầu xuất hóa đơn VAT cho chuyến xe Green SM, bạn cần tuân theo các hướng dẫn sau đây:\nI. Với các chuyến xe đặt qua ứng dụng\nCách 1: Tạo yêu cầu xuất hóa đơn VAT - trước khi đặt xe\n1: Vào mục \"Xuất hóa đơn & dịch vụ bổ sung tại đây.\" → bật “Xuất hóa đơn cho doanh nghiệp”\n2: Nhập mã số thuế của công ty\n3: Hệ thống sẽ tự động tìm tên công ty theo mã số thuế\n4: Kiểm tra lại thông tin → Chọn “Lưu”\n5: Sau khi lưu, thông tin xuất hóa đơn sẽ hiển thị ở màn hình Dịch vụ\n6: Tại mục \"Xuất hóa đơn cho chuyến đi tiếp theo\": \"Bật\" nếu bạn cần xuất hóa đơn tự động và \"Tắt\" nếu bạn chưa có nhu cầu.\nCách 2: Tạo yêu cầu xuất hóa đơn VAT - khi đang trong chuyến đi\n1: Mở chuyến đi đang thực hiện → Chọn “Xuất hóa đơn”\n2: Làm theo các bước tương tự như Cách 1 (nhập mã số thuế, kiểm tra, lưu)\nII. Với các chuyến xe KHÔNG đặt qua ứng dụng\nGọi Hotline Green SM: 1555 trước hoặc trong chuyến đi để yêu cầu xuất hóa đơn.\nIII. Cách kiểm tra hóa đơn\n- Hóa đơn sẽ được gửi qua email mà Quý khách đã đăng ký khi tạo yêu cầu. Vui lòng kiểm tra hòm thư chính, quảng cáo và thư rác để không bỏ sót\n- Với các chuyến đặt qua ứng dụng, Quý khách có thể xem lại tại:\nHoạt động > Chuyến đi tương ứng > Xuất hóa đơn.\nLưu ý:\n- Hóa đơn VAT sẽ được xuất ngay sau khi kết thúc chuyến đi\n- Quý khách cần yêu cầu xuất hóa đơn TRƯỚC khi chuyến đi kết thúc\n- Nếu không yêu cầu đúng thời điểm, Green SM sẽ không thể hỗ trợ xuất lại - theo quy định mới của Chính phủ\n- Cước phí trên hóa đơn giá trị gia tăng (VAT) không bao gồm các loại phí sau (nếu có): phí cầu đường, bến bãi, sân bay, đỗ xe, bảo hiểm,…",
  "char_count": 1665,
  "topic_tags": [
    "invoice",
    "vat"
  ],
  "priority": "critical",
  "retrieval_role": "standalone",
  "parent_source_id": null,
  "faq_range": [
    "3.4"
  ]
}
