{
  "schema_version": "0.2.0",
  "source_id": "GSM-HELP-CANCELLED-CHARGE-306",
  "title": "FAQ 3.6 — Hủy chuyến nhưng vẫn bị trừ tiền",
  "canonical_url": "https://www.greensm.com/vn-vi/helps",
  "requested_url": "https://www.greensm.com/vn-vi/helps",
  "final_url": "https://www.greensm.com/vn-vi/helps",
  "content_selector": "faq:3.6",
  "language": "vi",
  "publisher": "Green SM",
  "fetched_at": "2026-08-10T07:00:31+07:00",
  "http_status": 200,
  "content_type": "text/html; charset=utf-8",
  "raw_sha256": "898e02cb0f3967f8b0d3206fbfa645ee1afec79b88c8b3b9fde65a245f9bf1f8",
  "content_sha256": "7223a5817f2ee6786f5d7ff51653b5db3dbb928335a37f4aaa42b4f40284f415",
  "extraction_strategy": "dom_semantic",
  "source_last_modified": null,
  "parser_version": "0.2.0",
  "normalizer_version": "0.1.0",
  "materializer_version": "0.2.0",
  "materialization_mode": "next_content_faq",
  "materialization_payload_sha256": "e73f8d52a13c76ce2729272fc85f9bb1f8ed43717cbb011aec200fa4cf37555b",
  "content_kind": "text",
  "ocr_status": null,
  "text_retrieval_eligible": true,
  "asset_urls": [],
  "normalized_text": "3.6. Chuyến xe bị hủy nhưng tôi vẫn bị trừ tiền trong thẻ\nGreen SM rất lấy làm tiếc khi bạn gặp phải tình huống này. Với những chuyến xe bị hủy và thực tế không sử dụng dịch vụ, bạn hãy yên tâm rằng cước phí chuyến xe chắc chắn sẽ được hoàn lại về trong thẻ của bạn. Tùy thuộc vào chính sách của từng ngân hàng, sẽ có ngân hàng chưa hỗ trợ thông báo qua tin nhắn SMS khi số tiền được hoàn về tài khoản, vì vậy bạn vui lòng kiểm tra sao kê, giao dịch với ngân hàng.\nNgoài ra, bạn cũng có thể gửi yêu cầu tại mục \"Trung tâm hỗ trợ\" trên ứng dụng Green SM để được kiểm tra và giải đáp kịp thời.",
  "char_count": 591,
  "topic_tags": [
    "cancelled_trip",
    "charge"
  ],
  "priority": "critical",
  "retrieval_role": "standalone",
  "parent_source_id": null,
  "faq_range": [
    "3.6"
  ]
}
